{
  "name": "mcp_server_addon",
  "version": "1.0.0",
  "type": "processing_addon",
  "author": "StoryCore Team",
  "description": "Serveur MCP (Model Context Protocol) pour l'intÃ©gration de services externes via JSON-RPC 2.0",
  "compatibility": {
    "engine_version": ">=2.0.0"
  },
  "permissions": [
    "network_access",
    "file_system_read",
    "file_system_write",
    "system_info_access"
  ],
  "entry_points": {
    "main": "src/main.py"
  },
  "dependencies": {
    "asyncio": ">=3.4.3",
    "json-rpc": ">=4.0.0",
    "websockets": ">=10.0"
  },
  "metadata": {
    "protocol": "MCP",
    "rpc_version": "2.0",
    "communication": "stdio",
    "security_level": "high",
    "supported_features": [
      "resource_access",
      "tool_execution",
      "notifications"
    ]
  }
}